FamilyID,PublishedProtocolBasis,LocalProxyRule,ExactAuthorNative,ManualJudgmentRequiredByPaper,NumericalExportAvailable,UsedInThisRun,ResidualRisk,ClaimBoundary
AUTHOR_DA_FILTERED_PROXY,d_A criteria I-III: MSE threshold plus derivative/oscillation rejection,D derivative-regularized branch; finite predictions; curvature-regularized selection,False,True,True,True,manual shape rejection and author expression exports are unavailable,author_protocol_guided_reproduction_no_measurement_validation
AUTHOR_HD_CRITERIA_1_SIMPLE_PROXY,H_D criteria set 1: three simplest nonconstant nonlinear hall-of-fame expressions,lowest H complexity nonconstant bootstrap expressions; nonlinear marker preferred when present,False,True,True,True,local metadata lacks the full PySR hall-of-fame and exact three-expression selection,author_protocol_guided_reproduction_no_measurement_validation
AUTHOR_HD_CRITERIA_2_LOW_LOSS_PROXY,H_D criteria set 2: up to three lowest-loss nonpathological hall-of-fame expressions,lowest H loss bootstrap expressions with finite prediction; pathology rejection approximated by finite outputs,False,True,True,True,"manual nonpathological filtering is approximated, not author-native",author_protocol_guided_reproduction_no_measurement_validation
AUTHOR_HD_CRITERIA_3_LOSS_COMPLEXITY,H_D criteria set 3: minimize Loss + 1.0 * Complexity,registered normalized criteria-3 bootstrap selector,False,False,True,True,PySR/cp3-bench implementation details and author seeds may differ,author_protocol_guided_reproduction_no_measurement_validation
AUTHOR_DESI_BRANCH_TARGET,DESI radial BAO branch,requires branch-specific D/H bootstrap rerun using DESI-only training input,False,False,False,False,"current H branch uses combined radial BAO training input, not isolated DESI-only family",author_protocol_guided_reproduction_no_measurement_validation
AUTHOR_BOSS_EBOSS_BRANCH_TARGET,BOSS/eBOSS radial BAO branch,requires branch-specific D/H bootstrap rerun using BOSS/eBOSS-only training input,False,False,False,False,"current H branch uses combined radial BAO training input, not isolated BOSS/eBOSS-only family",author_protocol_guided_reproduction_no_measurement_validation
