ProtocolID,ComparatorID,ComparatorClass,Role,Definition,FrozenBeforeCandidateScoring,UsesTargetResiduals,UsesCandidateScore,ClaimBoundary
P5B_BACKREACTION_36_FROZEN_MORPHOLOGY_PROTOCOL_v1,POLY_DEG2,baseline_absorber,primary,Quadratic baseline absorber on declared clock coordinate.,True,False,False,backreaction_36_null_comparators_frozen_before_candidate
P5B_BACKREACTION_36_FROZEN_MORPHOLOGY_PROTOCOL_v1,WRONG_CLOCK_BSTAR,bstar_like_negative_control,primary,Same generator with frozen wrong-clock convention.,True,False,False,backreaction_36_null_comparators_frozen_before_candidate
P5B_BACKREACTION_36_FROZEN_MORPHOLOGY_PROTOCOL_v1,PHASE_SHIFTED_BSTAR,bstar_like_negative_control,primary,Same support and smoothness with frozen clock phase shift.,True,False,False,backreaction_36_null_comparators_frozen_before_candidate
P5B_BACKREACTION_36_FROZEN_MORPHOLOGY_PROTOCOL_v1,FAMILY_PERMUTED_BSTAR,bstar_like_negative_control,primary,Same values permuted across family labels before scoring.,True,False,False,backreaction_36_null_comparators_frozen_before_candidate
P5B_BACKREACTION_36_FROZEN_MORPHOLOGY_PROTOCOL_v1,RANDOM_SMOOTH_ACTIVE_SUPPORT_NULL,smooth_template_negative_control,primary,Target-blind random smooth active-support null with fixed seed manifest.,True,False,False,backreaction_36_null_comparators_frozen_before_candidate
P5B_BACKREACTION_36_FROZEN_MORPHOLOGY_PROTOCOL_v1,OSCILLATORY_NULL_DIAGNOSTIC_ONLY,diagnostic_control,secondary,Oscillatory geometry control; not a natural smooth weak-response class.,True,False,False,backreaction_36_null_comparators_frozen_before_candidate
P5B_BACKREACTION_36_FROZEN_MORPHOLOGY_PROTOCOL_v1,LOW_DF_SPLINE_CONTROL,baseline_absorber,secondary,Fixed-knot low-df smooth absorber robustness control.,True,False,False,backreaction_36_null_comparators_frozen_before_candidate
