GateID,Objective,LockedPrediction,NullComparators,RequiredInputs,CovariancePolicy,CurrentStatus,FalsificationCriteria,NextAction
G1_BAO_MEMORY_WINDOW,Test whether the locked K2 window remains non-violating for BAO-only diagnostics,W(x)=1+rho*x^3 with rho<=4,No-memory and smooth-response controls,BAO reconstruction points plus envelope or likelihood products,Envelope now and covariance-aware later,preflight_branch_closed_no_locked_k1_target,BAO-only envelope or likelihood rejects the locked window without changing null controls,Freeze BAO as preflight/control branch until a coordinate-native or likelihood-native K1 response target is selected
G2_SN_BAO_SIGN_STABILITY,Separate sign-stable tension from reconstruction-sensitive sign warnings,Locked K2 sign and amplitude over frozen x grid,Sign-randomized and reconstruction-family controls,SN+BAO reconstruction families with point-level signs,Shrinkage covariance acceptable as interim,next_stage_required,Sign-stable points require the opposite locked sign under the same benchmark,Build public sign-family table with covariance score
G3_COORDINATE_ROBUSTNESS,Check whether compatibility survives alternative depth mappings,Same K2 window under each frozen mapping,Coordinate-remap controls,Redshift comoving-distance optical-depth-like and likelihood-native mappings,Same covariance policy for each mapping,diagnosed_chi_operator_only_warning_bounded_rho_recoverable,Compatibility appears only for one post-hoc coordinate mapping,Test coordinate-native K1 / likelihood-native reconstruction and covariance-aware scoring
G4_COVARIANCE_LIKELIHOOD,Move from envelope compatibility to measurement gate scoring,Same locked K2 window,All registered null comparators,Public likelihood products or covariance matrices,Full covariance preferred shrinkage covariance allowed if declared,null_model_mvp_completed_bao_public_preflight_closed,Locked K2 is rejected or not competitive against null comparators under fixed complexity,Prioritize SN+BAO/source-split or coordinate-native benchmark while BAO remains a control branch
G5_CROSS_BRANCH_PATTERN,Check whether the same finite-memory response family appears across independent diagnostics,No retuning of K2 shape after branch inspection,Branch-specific null comparators,BAO SN+BAO and future independent diagnostic packets,Covariance-aware where available and envelope-only flagged,planned,Each branch requires incompatible response shape or amplitude,Define branch-independent scorecard
