ProtocolID,FreezeID,PolicyID,PolicyClass,Definition,FrozenValue,TargetResidualsUsedForPolicy,ScoreOutcomeUsedForPolicy,PTauCovScoringAuthorized,ClaimBoundary
P_TAUCOV_BRANCH_LOCALIZED_COVARIANCE_RESPONSE_v1,P_TAUCOV_PARENT_ACTION_DF_COVARIANCE_POLICY_FREEZE_v1,PARAM_ALPHA,degrees_of_freedom,single scalar alpha for C=C0+alpha*K_tau,1,False,False,False,parent_action_df_covariance_policy_freeze_no_scoring
P_TAUCOV_BRANCH_LOCALIZED_COVARIANCE_RESPONSE_v1,P_TAUCOV_PARENT_ACTION_DF_COVARIANCE_POLICY_FREEZE_v1,ALPHA_DOMAIN,parameter_bounds,alpha is fitted under fixed PSD-preserving covariance constraints,fixed_by_scorecard_regularizer,False,False,False,parent_action_df_covariance_policy_freeze_no_scoring
P_TAUCOV_BRANCH_LOCALIZED_COVARIANCE_RESPONSE_v1,P_TAUCOV_PARENT_ACTION_DF_COVARIANCE_POLICY_FREEZE_v1,KERNEL_POLICY,kernel,primary kernel is target-blind PSD covariance map from parent-action response,PSD,False,False,False,parent_action_df_covariance_policy_freeze_no_scoring
P_TAUCOV_BRANCH_LOCALIZED_COVARIANCE_RESPONSE_v1,P_TAUCOV_PARENT_ACTION_DF_COVARIANCE_POLICY_FREEZE_v1,COVARIANCE_REGULARIZATION,regularization,use predeclared ridge/jitter only if required for numerical positive definiteness,scorecard_declared,False,False,False,parent_action_df_covariance_policy_freeze_no_scoring
P_TAUCOV_BRANCH_LOCALIZED_COVARIANCE_RESPONSE_v1,P_TAUCOV_PARENT_ACTION_DF_COVARIANCE_POLICY_FREEZE_v1,INFORMATION_CRITERION,model_comparison,AIC and BIC count df=1 for the parent-action deformation,df_1,False,False,False,parent_action_df_covariance_policy_freeze_no_scoring
P_TAUCOV_BRANCH_LOCALIZED_COVARIANCE_RESPONSE_v1,P_TAUCOV_PARENT_ACTION_DF_COVARIANCE_POLICY_FREEZE_v1,NO_SECONDARY_RESCUE,claim_boundary,diagnostic contrasts cannot rescue failed primary covariance score,forbidden,False,False,False,parent_action_df_covariance_policy_freeze_no_scoring
