ProtocolID,FreezeID,ComponentID,Role,CandidateSource,SourceExists,SourceStatus,BlockingIssue,ScoringAuthorized,ClaimBoundary
P_TAUCOV_BRANCH_LOCALIZED_COVARIANCE_RESPONSE_v1,P_TAUCOV_TCCS_SOURCE_REGISTRY_v1,L_B_red,parent-side reduced B-Hessian or response operator,evidence/p_taucov_parent_hessian_commutator_object.csv; evidence/p_taucov_projection_essentiality_parent_action_hessian.csv,True,AVAILABLE_FOR_OBJECT_PREFLIGHT,none for preflight; must still pass TCCS object-construction gates,False,tccs_source_registry_no_object_no_scoring
P_TAUCOV_BRANCH_LOCALIZED_COVARIANCE_RESPONSE_v1,P_TAUCOV_TCCS_SOURCE_REGISTRY_v1,P_morph,morphology/projection readout operator,evidence/p_taucov_p4_morphology_basis.csv; evidence/p_taucov_p4_morphology_basis_summary.csv,True,FROZEN_OPERATOR_CONVENTION_AVAILABLE,none for preflight; convention frozen in p_taucov_tccs_pmorph_piperp_summary.csv,False,tccs_source_registry_no_object_no_scoring
P_TAUCOV_BRANCH_LOCALIZED_COVARIANCE_RESPONSE_v1,P_TAUCOV_TCCS_SOURCE_REGISTRY_v1,Pi_perp,projection-null and morphology-null orthogonal complement projector,evidence/p_taucov_p4_morphology_orthogonalization_gate.csv; projection-null controls from parent-action null comparator packet,True,FROZEN_MATRIX_AVAILABLE,none for preflight; matrix frozen in p_taucov_tccs_piperp_matrix.csv,False,tccs_source_registry_no_object_no_scoring
P_TAUCOV_BRANCH_LOCALIZED_COVARIANCE_RESPONSE_v1,P_TAUCOV_TCCS_SOURCE_REGISTRY_v1,Pi_bal,family/clock balanced subspace projector,evidence/p_taucov_clock_family_balance_projector_matrix.csv,True,AVAILABLE,none for registry; must be checked again after TCCS object construction,False,tccs_source_registry_no_object_no_scoring
P_TAUCOV_BRANCH_LOCALIZED_COVARIANCE_RESPONSE_v1,P_TAUCOV_TCCS_SOURCE_REGISTRY_v1,J_tau,target-blind parent-side orientation anchor,evidence/p_taucov_tccs_jtau_anchor_candidate_matrix.csv,True,FROZEN_ANCHOR_CANDIDATE_AVAILABLE,none for preflight; target-blind J_tau candidate frozen,False,tccs_source_registry_no_object_no_scoring
P_TAUCOV_BRANCH_LOCALIZED_COVARIANCE_RESPONSE_v1,P_TAUCOV_TCCS_SOURCE_REGISTRY_v1,TCCS_OBJECT,scoreable oriented branch-balanced projection-orthogonal commutator,not constructed,False,NOT_CONSTRUCTED_PREFLIGHT_READY,"object not constructed yet; next step is object-construction preflight, not scoring",False,tccs_source_registry_no_object_no_scoring
