CandidateID,NullID,Reference,URL,CandidateUse,LikelyMachineReadableData,NeedsDigitization,NeedsCovarianceExtraction,NeedsSourceSplitMapping,CurrentStatus,NextAction,ClaimBoundary,TriageRole,ExtractionPriority,ObservedNumericConstraintInAbstract,MachineReadableExpectation,PotentialUse,ImmediateAction,CanBeFirstIngestTarget,CanBeMeasurementInputNow,MissingBeforeIngest
PNC_BACKREACTION_KOKSBANG_2604_11249,BACKREACTION_ONLY,"Koksbang, First observational constraints on cosmic backreaction over an extended redshift range",https://arxiv.org/abs/2604.11249,backreaction envelope or constraints over redshift,unknown,True,True,True,candidate_not_ingested,"inspect paper/source files for tables, expressions, or repository links usable as backreaction calibration source",physical_null_candidate_triage_no_measurement_validation,primary_backreaction_candidate,1,False,TeX/PDF extraction likely required; arXiv source exists,backreaction envelope over redshift if constraints can be digitized or source tables found,inspect TeX source and figures for redshift-binned backreaction constraints,True,False,paper_source_or_tables;row_mapping;covariance_or_uncertainty
PNC_DYER_ROEDER_SNE_GRB_1303_1574,DYER_ROEDER_OPTICAL,Observational constraints from SNe Ia and Gamma-Ray Bursts on a clumpy universe,https://arxiv.org/abs/1303.1574,smoothness parameter alpha constraint for optical-propagation calibration,paper_constraints_or_tables,True,True,True,candidate_not_ingested,extract alpha constraints and uncertainty; check whether redshift-dependent information is available,physical_null_candidate_triage_no_measurement_validation,primary_optical_candidate,2,True,abstract gives alpha constraints; table/source check still required,constant smoothness-parameter prior for Dyer-Roeder optical amplitude,extract alpha best fits and uncertainties; decide whether constant-alpha prior can map to source-split rows,True,False,paper_source_or_tables;row_mapping;covariance_or_uncertainty
PNC_DYER_ROEDER_SMOOTHNESS_DD_1305_6989,DYER_ROEDER_OPTICAL,Constraining smoothness parameter and the DD relation of Dyer-Roeder equation with supernovae,https://arxiv.org/abs/1305.6989,smoothness parameter and distance-duality check for optical calibration,paper_constraints_or_tables,True,True,True,candidate_not_ingested,inspect constraints for alpha and uncertainty usable as optical null amplitude prior,physical_null_candidate_triage_no_measurement_validation,secondary_optical_candidate,3,True,abstract gives alpha constraint; source/table check still required,constant smoothness-parameter prior and DD consistency check,extract alpha=0.92 constraint and uncertainty; check if it can serve as conservative optical prior,True,False,paper_source_or_tables;row_mapping;covariance_or_uncertainty
PNC_BACKREACTION_HEINESEN_CLIFTON_2604_07244,BACKREACTION_ONLY;DYER_ROEDER_OPTICAL,"Heinesen and Clifton, Observational Tests for Distinguishing Classes of Cosmological Models",https://arxiv.org/abs/2604.07244,method/source for separating optical-property and expansion/backreaction effects,method_reference,False,True,True,method_candidate_not_ingested,use as classification/mapping reference; not a direct amplitude source unless tables are available,physical_null_candidate_triage_no_measurement_validation,method_mapping_reference,4,False,method note; not direct amplitude source,classification of optical-property versus expansion/backreaction deviations,"use as mapping/interpretation reference, not first amplitude-ingest target",False,False,paper_source_or_tables;row_mapping;covariance_or_uncertainty
PNC_WEAK_LENSING_DYER_ROEDER_IPAC_1999,DYER_ROEDER_OPTICAL,Analytical Modeling of the Weak Lensing of Standard Candles I,https://www.ipac.caltech.edu/publication/1999ApJ...525..651W,weak-lensing to generalized Dyer-Roeder mapping reference,method_reference,False,True,True,method_candidate_not_ingested,use as optical-proxy mapping reference if a public lensing amplitude source is selected,physical_null_candidate_triage_no_measurement_validation,optical_mapping_reference,5,False,method reference,mapping from weak-lensing magnification to generalized Dyer-Roeder smoothness,retain for transform design if lensing/convergence source is selected,False,False,paper_source_or_tables;row_mapping;covariance_or_uncertainty
PNC_REDUCED_CONVERGENCE_SMOOTHNESS_IPAC_2005,DYER_ROEDER_OPTICAL,Reduced Convergence and the Local Smoothness Parameter,https://www.ipac.caltech.edu/publication/2005ApJ...624...46W,mapping between weak-lensing reduced convergence and smoothness parameter,method_reference,False,True,True,method_candidate_not_ingested,use only if a compatible lensing/convergence source with uncertainty is selected,physical_null_candidate_triage_no_measurement_validation,optical_mapping_reference,6,False,method reference,mapping between reduced convergence and local smoothness parameter,retain for transform design if convergence source is selected,False,False,paper_source_or_tables;row_mapping;covariance_or_uncertainty
