PolicyID,PolicyClass,CovarianceSource,CrossCovarianceRule,ShrinkageAllowed,BranchScatterAllowed,TuningAfterScorecardAllowed,CanSupportPreflight,CanSupportMeasurementValidation,CurrentAvailable,BlockingIssue,RequiredBeforeUse,ClaimBoundary
PCOV_POLICY_FULL_PUBLIC_LIKELIHOOD_NATIVE_V1,preferred_measurement_route,public_SN_BAO_likelihood_covariance,derive_from_public_likelihood_or_joint_covariance_release,False,False,False,True,True,False,full_likelihood_native_public_covariance_missing,public covariance transform and cross-covariance rule must be frozen before scorecard execution,public_covariance_policy_registry_no_measurement_validation
PCOV_POLICY_REGISTERED_SHRINKAGE_V1,registered_public_benchmark_proxy,public_covariance_proxy_plus_predeclared_shrinkage,predeclared_shrinkage_or_zero_cross_covariance_with_sensitivity_reported,True,False,False,True,False,False,registered_shrinkage_parameters_not_frozen_for_public_rerun,"lambda, correlation family, cross-covariance handling, and null policies must be frozen before rerun",public_covariance_policy_registry_no_measurement_validation
PCOV_POLICY_ROW_ALIGNED_CROSS_COV_SENSITIVITY_V1,sensitivity_only,public_proxy_with_row_aligned_cross_covariance_grid,rho_cross_grid_used_only_for_sensitivity_not_selection,False,False,False,True,False,True,cross_covariance_grid_is_not_likelihood_native,must be reported as sensitivity and cannot select best rho_cross as the benchmark,public_covariance_policy_registry_no_measurement_validation
PCOV_POLICY_BRANCH_SCATTER_REGISTERED_V1,secondary_preflight_bridge,SN_BAO_branch_scatter_or_reconstruction_family_scatter,not_applicable_unless_combined_with_public_covariance,False,True,False,True,False,False,branch_scatter_not_registered_as_independent_systematic_or_family_scatter,"declare whether branch scatter is systematic floor, reconstruction-family scatter, or sensitivity route",public_covariance_policy_registry_no_measurement_validation
PCOV_POLICY_FORBIDDEN_TUNED_ROUTE,forbidden,any_route_selected_after_K2_vs_control_score,forbidden_if_tuned_to_make_K2_competitive,False,False,False,False,False,False,post_hoc_covariance_rescue_forbidden,never allowed for stronger interpretation,public_covariance_policy_registry_no_measurement_validation
