AuditID,CheckID,Before,After,RatioAfterBefore,Status,Interpretation,MeasurementValidationAllowed,ClaimBoundary
REGULARIZED_VS_UNREGULARIZED_DECISION_AUDIT_V1,LOW_DEPTH_OMEGA_REDUCTION,56.50157458079968,2.8117954539384766,0.049764904337621395,SUPPORTS_REGULARIZED_SELECTOR,low-depth Omega amplitude is strongly reduced by D-branch derivative regularity governance,False,regularized_vs_unregularized_decision_audit_no_measurement_validation
REGULARIZED_VS_UNREGULARIZED_DECISION_AUDIT_V1,LOW_DEPTH_DERIVATIVE_REDUCTION,2.668531784171269,1.889860522226933e-09,7.082023655992699e-10,SUPPORTS_REGULARIZED_SELECTOR,median low-depth derivative curvature is suppressed without changing locked K2,False,regularized_vs_unregularized_decision_audit_no_measurement_validation
REGULARIZED_VS_UNREGULARIZED_DECISION_AUDIT_V1,MIDHIGH_OMEGA_NOT_ERASED,1.5019022688327135,1.9290320688697316,1.2843925393154814,WARNING,mid/high smoke amplitude remains present; this is useful for control scoring but still smoke-scale,False,regularized_vs_unregularized_decision_audit_no_measurement_validation
REGULARIZED_VS_UNREGULARIZED_DECISION_AUDIT_V1,K2_BEATS_REGULARIZED_SMOKE,2.0,2.0,1.0,SUPPORTS_LOCKED_K2_PREFLIGHT,locked K2 still beats the regularized smoke backreaction null in all scored routes,False,regularized_vs_unregularized_decision_audit_no_measurement_validation
REGULARIZED_VS_UNREGULARIZED_DECISION_AUDIT_V1,SMOKE_K2_CORRELATION_CHANGE,-0.3321412879026154,0.4790238347297145,-1.4422291120583763,SUPPORTS_SELECTOR_SCALE_UP,"regularization changes the smoke null from anti-correlated to positively correlated with locked K2, while K2 remains lower chi2",False,regularized_vs_unregularized_decision_audit_no_measurement_validation
REGULARIZED_VS_UNREGULARIZED_DECISION_AUDIT_V1,ROUTE_SCORE_PUBLIC_PROXY_WHITENED_STANDARDIZED,43.597856783814855,45.70392617023057,1.0483067183063357,REGULARIZED_NULL_STILL_WORSE_THAN_K2,PUBLIC_PROXY_WHITENED_STANDARDIZED: regularized smoke chi2 is compared against the unchanged locked K2 chi2,False,regularized_vs_unregularized_decision_audit_no_measurement_validation
REGULARIZED_VS_UNREGULARIZED_DECISION_AUDIT_V1,ROUTE_SCORE_REGISTERED_SHRINKAGE_WHITENED,40.457825161878134,47.77752358789729,1.1809216980085284,REGULARIZED_NULL_STILL_WORSE_THAN_K2,REGISTERED_SHRINKAGE_WHITENED: regularized smoke chi2 is compared against the unchanged locked K2 chi2,False,regularized_vs_unregularized_decision_audit_no_measurement_validation
