CovarianceID,TargetSpace,Status,UsesPublicSN,UsesPublicBAO,IncludesSNBAOCrossCovariance,CoordinateNative,K1Compatible,AllowedForK2Scoring,BlockingIssue,NextAction
SSCOV_DIAGONAL_STANDARDIZED_PROXY,standardized source-split rows,available,True,True,False,False,False,False,sn_bao_cross_covariance_missing;coordinate_native_false;k1_compatible_false;diagonal_proxy_only;k1_target_missing,Use as transform-development audit only.
SSCOV_WITHIN_ROW_CORRELATION_PROXY,standardized source-split rows,available,True,True,False,False,False,False,sn_bao_cross_covariance_missing;coordinate_native_false;k1_compatible_false;proxy_correlation_only;k1_target_missing,Use only for sensitivity checks.
SSCOV_BLOCK_DIAGONAL_PUBLIC_SN_BAO,public SN block plus public BAO block,planned,True,True,False,False,False,False,covariance_not_available;sn_bao_cross_covariance_missing;coordinate_native_false;k1_compatible_false;block_diagonal_not_joint_source_split;k1_target_missing,Use as interim covariance after target vector is defined.
SSCOV_SHRINKAGE_SOURCE_SPLIT,coordinate-native source-split vector,available,True,True,True,True,True,True,,Use as declared shrinkage covariance for source-split preflight scorecard; replace with public full covariance when available.
SSCOV_PUBLIC_JOINT_SOURCE_SPLIT,coordinate-native source-split vector,planned,True,True,True,True,False,False,covariance_not_available;k1_compatible_false;public_joint_covariance_missing;k1_target_missing,Use only when public joint covariance or reproducible reconstruction covariance exists.
SSCOV_LIKELIHOOD_NATIVE_PUBLIC,likelihood-native source-split benchmark,planned,True,True,True,True,False,False,covariance_not_available;k1_compatible_false;likelihood_native_covariance_missing;k1_target_missing,Promote only with likelihood-native public benchmark.
