CheckID,Question,Passed,Evidence,Interpretation,ClaimBoundary
K2_SIGN_MATCHES_SOURCE_SPLIT,Does locked K2 choose the same sign as the source-split response?,True,all-points K2 sign match=8/8,locked K2 direction follows source-split sign across the packet,source_split_geometry_no_measurement_validation
ANTI_ALIGNMENT_SIGN_STABLE_SUPPORT,Are sign-stable rows mostly SN/BAO anti-aligned?,True,sign-stable opposite-sign fraction=0.8; mean channel product=-1.1733978650929164,anti-aligned branch geometry supports source-split gain prior in stable rows,source_split_geometry_no_measurement_validation
HIGH_DEPTH_ANTI_ALIGNMENT_SUPPORT,Does high-depth regime retain anti-alignment support?,True,high-depth opposite-sign fraction=0.6666666666666666; anti-aligned+K2 match=2/3,high-depth branch geometry is compatible with A_tau=2,source_split_geometry_no_measurement_validation
MID_HIGH_NOT_UNIFORMLY_ANTI_ALIGNED,Is the full mid/high set uniformly anti-aligned?,True,mid-high opposite-sign fraction=0.5; mean channel product=0.6642054476322933,A2 support is not reducible to simple anti-alignment in every row; depth activation is also required,source_split_geometry_no_measurement_validation
AOPT_MID_HIGH_NEAR_2,Does mid/high public-proxy amplitude point back to A_tau≈2?,True,mid-high AOpt=1.94754,source-split projection amplitude is close to the locked A2 prior,source_split_geometry_no_measurement_validation
AOPT_HIGH_DEPTH_NEAR_2,Does high-depth public-proxy amplitude point back to A_tau≈2?,True,high-depth AOpt=1.97686,activated high-depth response supports A_tau=2 specifically,source_split_geometry_no_measurement_validation
AOPT_ANTI_ALIGNED_NEAR_2,Does anti-aligned memory-active amplitude remain near A_tau=2?,True,memory-active anti-aligned AOpt=1.73097,anti-aligned rows are compatible with a two-channel source-split gain,source_split_geometry_no_measurement_validation
MEMORY_ACTIVE_SCORE_SUPPORT,Does memory-active scoring support A2 against K1/unit/polynomial controls?,True,mid-high DeltaAIC A2-K1=-3.126603990232332; A2-unit=-0.973487913044713; A2-poly=-6.466013387362281,projection gain prior improves the memory-active scorecard,source_split_geometry_no_measurement_validation
DEPTH_ACTIVATION_CONTEXT,Does this geometry sit inside a passed depth-activation pattern?,True,depth activation passed checks=8/8,source-split geometry and depth activation are mutually consistent,source_split_geometry_no_measurement_validation
